{
  "$schema": "https://mojobox.dev/schemas/evidence-v1alpha1.json",
  "apiVersion": "evidence.mojobox.dev/v1alpha1",
  "kind": "Evidence",
  "subject": {
    "id": "dev.eac.skin-ths",
    "version": "1.1.0",
    "artifactDigest": "sha256:885d55967b35f4273c35da27bf5722e85e2dbe68656aaa2721d8cd55239f8512"
  },
  "manifestDigest": "sha256:e6fe8ff84c72e8649b137ab900a444880bb349c58d5faf3b4a60826d8c4df208",
  "specifications": {
    "dshStdRevision": "3df054302468d2091859db4b3bd079042d33f100"
  },
  "suite": {
    "id": "mojobox-stage0-schema",
    "version": "0.1.0",
    "digest": "sha256:d087107e062528eed0d0bfa5f8d2c26b4897e090a1ea60a445a945b195e4428d"
  },
  "issuer": "Mojobox catalog",
  "evidenceLevel": "Parsed",
  "result": "pass",
  "checks": [
    {
      "id": "manifest-schema",
      "result": "pass"
    },
    {
      "id": "artifact-sha256",
      "result": "pass"
    }
  ],
  "testedAt": "2026-09-26T00:00:00Z",
  "expiresAt": "2026-12-26T00:00:00Z",
  "revoked": false
}
