{
  "$schema": "https://mojobox.dev/schemas/evidence-v1alpha1.json",
  "apiVersion": "evidence.mojobox.dev/v1alpha1",
  "kind": "Evidence",
  "subject": {
    "id": "dev.omdsh.dsh-better-sidebar",
    "version": "0.12.2",
    "artifactDigest": "sha256:5f80d9cfd7f250a675cf9bc7f951ca246c047f09607200831733f845c8255d0f"
  },
  "manifestDigest": "sha256:b2faa1e6a274e342dbbf23ce6e893677a14747a372a1912cd3f7b97f19c3680b",
  "specifications": {
    "dshStdRevision": "3df054302468d2091859db4b3bd079042d33f100"
  },
  "suite": {
    "id": "mojobox-stage0-schema",
    "version": "0.1.0",
    "digest": "sha256:d087107e062528eed0d0bfa5f8d2c26b4897e090a1ea60a445a945b195e4428d"
  },
  "issuer": "Mojobox catalog",
  "evidenceLevel": "Parsed",
  "result": "pass",
  "checks": [
    { "id": "manifest-schema", "result": "pass" },
    { "id": "artifact-sha256", "result": "pass" }
  ],
  "testedAt": "2026-08-30T00:00:00Z",
  "expiresAt": "2026-11-30T00:00:00Z",
  "revoked": false
}
