{
  "$schema": "https://mojobox.dev/schemas/evidence-v1alpha1.json",
  "apiVersion": "evidence.mojobox.dev/v1alpha1",
  "kind": "Evidence",
  "subject": {
    "id": "dev.eac.skin-minecraft",
    "version": "1.1.0",
    "artifactDigest": "sha256:a163eae0e8772ffd955b84e863e1a31eaa338ad531d6feaaf683725d04a1230f"
  },
  "manifestDigest": "sha256:ec37a462913e0b3d1753bc39d1f0a8a04de71ad709894d5d60a92312c9687217",
  "specifications": {
    "dshStdRevision": "3df054302468d2091859db4b3bd079042d33f100"
  },
  "suite": {
    "id": "mojobox-stage0-schema",
    "version": "0.1.0",
    "digest": "sha256:d087107e062528eed0d0bfa5f8d2c26b4897e090a1ea60a445a945b195e4428d"
  },
  "issuer": "Mojobox catalog",
  "evidenceLevel": "Parsed",
  "result": "pass",
  "checks": [
    {
      "id": "manifest-schema",
      "result": "pass"
    },
    {
      "id": "artifact-sha256",
      "result": "pass"
    }
  ],
  "testedAt": "2026-09-26T00:00:00Z",
  "expiresAt": "2026-12-26T00:00:00Z",
  "revoked": false
}
