{
  "$schema": "https://mojobox.dev/schemas/evidence-v1alpha1.json",
  "apiVersion": "evidence.mojobox.dev/v1alpha1",
  "kind": "Evidence",
  "subject": {
    "id": "dev.eac.skin-xp",
    "version": "1.1.0",
    "artifactDigest": "sha256:7ba298308484104719bbbf4257a39d32ed616a775cf6dd70e17d7afc9e803b0c"
  },
  "manifestDigest": "sha256:d0b82309cbd6588d45f4d1cafdf35bebab0378eb5fcf930b85e9245ca48f973b",
  "specifications": {
    "dshStdRevision": "3df054302468d2091859db4b3bd079042d33f100"
  },
  "suite": {
    "id": "mojobox-stage0-schema",
    "version": "0.1.0",
    "digest": "sha256:d087107e062528eed0d0bfa5f8d2c26b4897e090a1ea60a445a945b195e4428d"
  },
  "issuer": "Mojobox catalog",
  "evidenceLevel": "Parsed",
  "result": "pass",
  "checks": [
    {
      "id": "manifest-schema",
      "result": "pass"
    },
    {
      "id": "artifact-sha256",
      "result": "pass"
    }
  ],
  "testedAt": "2026-09-26T00:00:00Z",
  "expiresAt": "2026-12-26T00:00:00Z",
  "revoked": false
}
