{
  "$schema": "https://mojobox.dev/schemas/evidence-v1alpha1.json",
  "apiVersion": "evidence.mojobox.dev/v1alpha1",
  "kind": "Evidence",
  "subject": {
    "id": "dev.eac.skin-aurora",
    "version": "1.1.0",
    "artifactDigest": "sha256:3abf546ccbea8fa106290ed0a96c77661a9620e88fadb57b76afa12aa503cd35"
  },
  "manifestDigest": "sha256:9b678363da628e45a3a155f4f4b02f5ce822cdb3c519f682c21bf4751a292f13",
  "specifications": {
    "dshStdRevision": "3df054302468d2091859db4b3bd079042d33f100"
  },
  "suite": {
    "id": "mojobox-stage0-schema",
    "version": "0.1.0",
    "digest": "sha256:d087107e062528eed0d0bfa5f8d2c26b4897e090a1ea60a445a945b195e4428d"
  },
  "issuer": "Mojobox catalog",
  "evidenceLevel": "Parsed",
  "result": "pass",
  "checks": [
    {
      "id": "manifest-schema",
      "result": "pass"
    },
    {
      "id": "artifact-sha256",
      "result": "pass"
    }
  ],
  "testedAt": "2026-09-26T00:00:00Z",
  "expiresAt": "2026-12-26T00:00:00Z",
  "revoked": false
}
