{
  "$schema": "https://mojobox.dev/schemas/evidence-v1alpha1.json",
  "apiVersion": "evidence.mojobox.dev/v1alpha1",
  "kind": "Evidence",
  "subject": {
    "id": "dev.jing-hy.computer-user",
    "version": "0.3.6",
    "artifactDigest": "sha256:cf6e505c7ff76fec961cea757796b07b79e524b4c8b4403aa1319f74526b655b"
  },
  "manifestDigest": "sha256:77c0fba9300db7cd8ef2e7b6d4ca2b366f768b8164fa5585faefd0378b68d8b9",
  "specifications": {
    "dshStdRevision": "3df054302468d2091859db4b3bd079042d33f100"
  },
  "suite": {
    "id": "mojobox-stage0-schema",
    "version": "0.1.0",
    "digest": "sha256:d087107e062528eed0d0bfa5f8d2c26b4897e090a1ea60a445a945b195e4428d"
  },
  "issuer": "Mojobox catalog",
  "evidenceLevel": "Parsed",
  "result": "pass",
  "checks": [
    { "id": "manifest-schema", "result": "pass" },
    { "id": "artifact-sha256", "result": "pass" }
  ],
  "testedAt": "2026-08-30T00:00:00Z",
  "expiresAt": "2026-11-30T00:00:00Z",
  "revoked": false
}
