{
  "$schema": "https://mojobox.dev/schemas/evidence-v1alpha1.json",
  "apiVersion": "evidence.mojobox.dev/v1alpha1",
  "kind": "Evidence",
  "subject": {
    "id": "dev.scorp1o117.dsh-soul-md",
    "version": "0.2.8",
    "artifactDigest": "sha256:a3117a55e31c3594542f3c7c113b0620ab50de3867cef7ede36a59158cbc3dbd"
  },
  "manifestDigest": "sha256:84523258a280586872aab9571fc1edb5c53f63f94d01c8c620d80aa0a50f2a93",
  "specifications": {
    "dshStdRevision": "3df054302468d2091859db4b3bd079042d33f100"
  },
  "suite": {
    "id": "mojobox-stage0-schema",
    "version": "0.1.0",
    "digest": "sha256:d087107e062528eed0d0bfa5f8d2c26b4897e090a1ea60a445a945b195e4428d"
  },
  "issuer": "Mojobox catalog",
  "evidenceLevel": "Parsed",
  "result": "pass",
  "checks": [
    { "id": "manifest-schema", "result": "pass" },
    { "id": "artifact-sha256", "result": "pass" }
  ],
  "testedAt": "2026-08-30T00:00:00Z",
  "expiresAt": "2026-11-30T00:00:00Z",
  "revoked": false
}
